{
  "id": "public-outburst",
  "name": "events.public-outburst.name",
  "traits": [
    "dangerous"
  ],
  "description": "events.public-outburst.description",
  "modifiers": [
    {
      "type": "untyped",
      "value": -1,
      "name": "Event Occurred Once",
      "buttonLabel": "Event Occurred Once",
      "enabled": false
    },
    {
      "type": "untyped",
      "value": -2,
      "name": "Event Occurred More Than Once",
      "buttonLabel": "Event Occurred More Than Once",
      "enabled": false
    }
  ],
  "stages": [
    {
      "leader": "ruler",
      "skills": [
        "politics"
      ],
      "criticalSuccess": {
        "msg": "events.public-outburst.stage-0.criticalSuccess.msg"
      },
      "success": {
        "msg": "events.public-outburst.stage-0.success.msg"
      },
      "failure": {
        "msg": "events.public-outburst.stage-0.failure.msg"
      },
      "criticalFailure": {
        "msg": "events.public-outburst.stage-0.criticalFailure.msg"
      }
    }
  ]
}