{
  "id": "the-rampage-of-the-owlbear",
  "name": "events.the-rampage-of-the-owlbear.name",
  "modifier": 4,
  "traits": [
    "dangerous",
    "settlement"
  ],
  "location": "events.the-rampage-of-the-owlbear.location",
  "description": "events.the-rampage-of-the-owlbear.description",
  "modifiers": [
    {
      "name": "Settlement has only Water Borders",
      "buttonLabel": "Settlement has only Water Borders",
      "value": 0,
      "enabled": true,
      "applyIf": [
        {
          "eq": [
            "@waterBorders",
            4
          ]
        }
      ],
      "type": "untyped",
      "upgradeResults": [
        {
          "upgrade": "criticalFailure"
        },
        {
          "upgrade": "failure"
        },
        {
          "upgrade": "success"
        }
      ]
    }
  ],
  "stages": [
    {
      "leader": "warden",
      "skills": [
        "defense"
      ],
      "criticalSuccess": {
        "msg": "events.the-rampage-of-the-owlbear.stage-0.criticalSuccess.msg"
      },
      "success": {
        "msg": "events.the-rampage-of-the-owlbear.stage-0.success.msg"
      },
      "failure": {
        "msg": "events.the-rampage-of-the-owlbear.stage-0.failure.msg"
      },
      "criticalFailure": {
        "msg": "events.the-rampage-of-the-owlbear.stage-0.criticalFailure.msg"
      }
    }
  ],
  "resolution": "events.the-rampage-of-the-owlbear.resolution"
}