{
  "id": "feud",
  "name": "events.feud.name",
  "traits": [
    "continuous",
    "dangerous",
    "settlement"
  ],
  "description": "events.feud.description",
  "location": "events.feud.location",
  "stages": [
    {
      "leader": "counselor",
      "skills": [
        "politics"
      ],
      "criticalSuccess": {
        "msg": "events.feud.stage-0.criticalSuccess.msg"
      },
      "success": {
        "msg": "events.feud.stage-0.success.msg"
      },
      "failure": {
        "msg": "events.feud.stage-0.failure.msg"
      },
      "criticalFailure": {
        "msg": "events.feud.stage-0.criticalFailure.msg"
      }
    }
  ],
  "resolvedOn": [
    "criticalSuccess"
  ],
  "resolution": "events.feud.resolution"
}