{
  "id": "trouble-with-a-weird-gnome",
  "name": "events.trouble-with-a-weird-gnome.name",
  "traits": [
    "dangerous"
  ],
  "description": "events.trouble-with-a-weird-gnome.description",
  "stages": [
    {
      "leader": "magister",
      "skills": [
        "intrigue"
      ],
      "criticalSuccess": {
        "msg": "events.trouble-with-a-weird-gnome.stage-0.criticalSuccess.msg"
      },
      "success": {
        "msg": "events.trouble-with-a-weird-gnome.stage-0.success.msg"
      },
      "failure": {
        "msg": "events.trouble-with-a-weird-gnome.stage-0.failure.msg"
      },
      "criticalFailure": {
        "msg": "events.trouble-with-a-weird-gnome.stage-0.criticalFailure.msg"
      }
    }
  ]
}