{
  "id": "new-subjects",
  "name": "New Subjects",
  "traits": ["beneficial"],
  "description": "A small group of intelligent creatures joins your kingdom and submits to your rule, bringing along their knowledge of hidden places within your kingdom. (The exact nature and ancestry of these new subjects is determined by the GM.)",
  "stages": [
    {
      "leader": "emissary",
      "skills": ["statecraft"],
      "criticalSuccess": {
        "msg": "Your subjects blend in seamlessly and are welcomed by your citizens, while bringing their own unique contributions to your kingdom. You @gain6ResourceDiceNextTurn, and you gain an additional Region activity during the Activity phase of the next Kingdom turn."
      },
      "success": {
        "msg": "Your new subjects are welcomed, and their contributions help in the short term. @gain3ResourceDiceNextTurn"
      },
      "failure": {
        "msg": "Your new subjects endure discrimination from intolerant citizens in your kingdom, but they nonetheless bring willing hands to work and such resources as they possess. @gain1Unrest and @gain1ResourceDiceNextTurn"
      },
      "criticalFailure": {
        "msg": "Your new subjects encounter discrimination and xenophobia, and they are eventually driven back into the wild. @gain1d4Unrest and @gain1Strife"
      }
    }
  ]
}