{
  "id": "remarkable-treasure",
  "name": "events.remarkable-treasure.name",
  "traits": [
    "beneficial",
    "fortune"
  ],
  "modifier": 2,
  "description": "events.remarkable-treasure.description",
  "stages": [
    {
      "leader": "emissary",
      "skills": [
        "exploration"
      ],
      "criticalSuccess": {
        "msg": "events.remarkable-treasure.stage-0.criticalSuccess.msg",
        "modifiers": [
          {
            "name": "Remarkable Treasure: Critical Success",
            "buttonLabel": "Roll Twice and Take Better Result if Hiring Adventurers",
            "turns": 2,
            "rollTwiceKeepHighest": true,
            "type": "untyped",
            "enabled": true,
            "value": 0,
            "applyIf": [
              {
                "eq": [
                  "@action",
                  "hire-adventurers"
                ]
              }
            ]
          }
        ]
      },
      "success": {
        "msg": "events.remarkable-treasure.stage-0.success.msg"
      },
      "failure": {
        "msg": "events.remarkable-treasure.stage-0.failure.msg"
      },
      "criticalFailure": {
        "msg": "events.remarkable-treasure.stage-0.criticalFailure.msg"
      }
    }
  ]
}