{
  "id": "troll-sightings",
  "name": "events.troll-sightings.name",
  "traits": [
    "continuous",
    "dangerous"
  ],
  "description": "events.troll-sightings.description",
  "stages": [
    {
      "leader": "warden",
      "skills": [
        "defense"
      ],
      "criticalSuccess": {
        "msg": "events.troll-sightings.stage-0.criticalSuccess.msg"
      },
      "success": {
        "msg": "events.troll-sightings.stage-0.success.msg"
      },
      "failure": {
        "msg": "events.troll-sightings.stage-0.failure.msg"
      },
      "criticalFailure": {
        "msg": "events.troll-sightings.stage-0.criticalFailure.msg"
      }
    }
  ],
  "resolution": "events.troll-sightings.resolution"
}