{
  "id": "monster-activity",
  "name": "events.monster-activity.name",
  "traits": [
    "dangerous",
    "continuous",
    "hex"
  ],
  "location": "events.monster-activity.location",
  "description": "events.monster-activity.description",
  "stages": [
    {
      "leader": "ruler",
      "skills": [
        "defense"
      ],
      "criticalSuccess": {
        "msg": "events.monster-activity.stage-0.criticalSuccess.msg"
      },
      "success": {
        "msg": "events.monster-activity.stage-0.success.msg"
      },
      "failure": {
        "msg": "events.monster-activity.stage-0.failure.msg"
      },
      "criticalFailure": {
        "msg": "events.monster-activity.stage-0.criticalFailure.msg"
      }
    }
  ],
  "resolvedOn": [
    "criticalSuccess"
  ],
  "resolution": "events.monster-activity.resolution"
}