{
  "id": "the-founding-of-a-village",
  "name": "events.the-founding-of-a-village.name",
  "traits": [
    "beneficial",
    "hex"
  ],
  "location": "events.the-founding-of-a-village.location",
  "description": "events.the-founding-of-a-village.description",
  "stages": [
    {
      "skills": [
        "exploration"
      ],
      "leader": "warden",
      "criticalSuccess": {
        "msg": "events.the-founding-of-a-village.stage-0.criticalSuccess.msg"
      },
      "success": {
        "msg": "events.the-founding-of-a-village.stage-0.success.msg"
      },
      "failure": {
        "msg": "events.the-founding-of-a-village.stage-0.failure.msg"
      },
      "criticalFailure": {
        "msg": "events.the-founding-of-a-village.stage-0.criticalFailure.msg"
      }
    }
  ]
}