{
  "id": "drug-den",
  "name": "events.drug-den.name",
  "traits": [
    "continuous",
    "dangerous",
    "settlement"
  ],
  "modifier": 1,
  "location": "events.drug-den.location",
  "description": "events.drug-den.description",
  "stages": [
    {
      "leader": "counselor",
      "skills": [
        "intrigue"
      ],
      "criticalSuccess": {
        "msg": "events.drug-den.stage-0.criticalSuccess.msg"
      },
      "success": {
        "msg": "events.drug-den.stage-0.success.msg"
      },
      "failure": {
        "msg": "events.drug-den.stage-0.failure.msg"
      },
      "criticalFailure": {
        "msg": "events.drug-den.stage-0.criticalFailure.msg"
      }
    }
  ],
  "resolvedOn": [
    "criticalSuccess"
  ],
  "resolution": "events.drug-den.resolution"
}