{
  "id": "public-scandal",
  "name": "events.public-scandal.name",
  "traits": [
    "dangerous"
  ],
  "description": "events.public-scandal.description",
  "stages": [
    {
      "leader": "counselor",
      "skills": [
        "intrigue"
      ],
      "criticalSuccess": {
        "msg": "events.public-scandal.stage-0.criticalSuccess.msg"
      },
      "success": {
        "msg": "events.public-scandal.stage-0.success.msg"
      },
      "failure": {
        "msg": "events.public-scandal.stage-0.failure.msg"
      },
      "criticalFailure": {
        "msg": "events.public-scandal.stage-0.criticalFailure.msg"
      }
    }
  ]
}