{
  "id": "plague",
  "name": "events.plague.name",
  "modifier": 1,
  "traits": [
    "continuous",
    "dangerous",
    "settlement"
  ],
  "location": "events.plague.location",
  "description": "events.plague.description",
  "modifiers": [
    {
      "type": "item",
      "name": "No Dump in Settlement",
      "buttonLabel": "No Dump in Settlement",
      "value": -4,
      "enabled": true,
      "applyIf": [
        {
          "not": {
            "in": [
              "dump",
              "@structures"
            ]
          }
        }
      ]
    },
    {
      "type": "item",
      "name": "Has Sewer System in Settlement",
      "buttonLabel": "Has Sewer System in Settlement",
      "value": 2,
      "enabled": true,
      "applyIf": [
        {
          "in": [
            "sewer-system",
            "@structures"
          ]
        }
      ]
    }
  ],
  "stages": [
    {
      "leader": "ruler",
      "skills": [
        "defense"
      ],
      "criticalSuccess": {
        "msg": "events.plague.stage-0.criticalSuccess.msg"
      },
      "success": {
        "msg": "events.plague.stage-0.success.msg",
        "modifiers": [
          {
            "type": "status",
            "name": "Settlement without Sewer System suffering from Plague",
            "buttonLabel": "Plague Civic penalty",
            "value": -2,
            "enabled": true,
            "applyIf": [
              {
                "eq": [
                  "@phase",
                  "civic"
                ]
              },
              {
                "in": [
                  "plague",
                  "@settlementEvents"
                ]
              },
              {
                "not": {
                  "in": [
                    "sewer-system",
                    "@structures"
                  ]
                }
              }
            ]
          }
        ]
      },
      "failure": {
        "msg": "events.plague.stage-0.failure.msg",
        "modifiers": [
          {
            "type": "status",
            "name": "Settlement without Sewer System suffering from Plague",
            "buttonLabel": "Plague Civic penalty",
            "value": -2,
            "enabled": true,
            "applyIf": [
              {
                "eq": [
                  "@phase",
                  "civic"
                ]
              },
              {
                "in": [
                  "plague",
                  "@settlementEvents"
                ]
              },
              {
                "not": {
                  "in": [
                    "sewer-system",
                    "@structures"
                  ]
                }
              }
            ]
          }
        ]
      },
      "criticalFailure": {
        "msg": "events.plague.stage-0.criticalFailure.msg",
        "modifiers": [
          {
            "type": "status",
            "name": "Settlement without Sewer System suffering from Plague",
            "buttonLabel": "Plague Civic penalty",
            "value": -2,
            "enabled": true,
            "applyIf": [
              {
                "eq": [
                  "@phase",
                  "civic"
                ]
              },
              {
                "in": [
                  "plague",
                  "@settlementEvents"
                ]
              },
              {
                "not": {
                  "in": [
                    "sewer-system",
                    "@structures"
                  ]
                }
              }
            ]
          }
        ]
      }
    }
  ],
  "resolvedOn": [
    "criticalSuccess"
  ],
  "resolution": "events.plague.resolution",
  "special": "events.plague.special"
}