{
  "id": "barbarian-immigrants",
  "name": "events.barbarian-immigrants.name",
  "description": "events.barbarian-immigrants.description",
  "modifier": 2,
  "traits": [
    "beneficial"
  ],
  "stages": [
    {
      "leader": "warden",
      "skills": [
        "statecraft"
      ],
      "criticalSuccess": {
        "msg": "events.barbarian-immigrants.stage-0.criticalSuccess.msg",
        "modifiers": [
          {
            "name": "events.barbarian-immigrants.stage-0.criticalSuccess.modifiers.barbarianSupport.name",
            "buttonLabel": "events.barbarian-immigrants.stage-0.criticalSuccess.modifiers.barbarianSupport.buttonLabel",
            "type": "circumstance",
            "value": 2,
            "enabled": true,
            "applyIf": [
              {
                "in": [
                  "@event",
                  [
                    "bandit-activity",
                    "monster-activity",
                    "undead-uprising"
                  ]
                ]
              }
            ]
          }
        ]
      },
      "success": {
        "msg": "events.barbarian-immigrants.stage-0.success.msg",
        "modifiers": [
          {
            "name": "events.barbarian-immigrants.stage-0.criticalSuccess.modifiers.barbarianSupport.name",
            "buttonLabel": "events.barbarian-immigrants.stage-0.criticalSuccess.modifiers.barbarianSupport.buttonLabel",
            "type": "circumstance",
            "value": 1,
            "enabled": true,
            "applyIf": [
              {
                "in": [
                  "@event",
                  [
                    "bandit-activity",
                    "monster-activity",
                    "undead-uprising"
                  ]
                ]
              }
            ]
          }
        ]
      },
      "failure": {
        "msg": "events.barbarian-immigrants.stage-0.failure.msg"
      },
      "criticalFailure": {
        "msg": "events.barbarian-immigrants.stage-0.criticalFailure.msg"
      }
    }
  ]
}