{
  "id": "archeological-find",
  "name": "events.archeological-find.name",
  "traits": [
    "beneficial",
    "hex"
  ],
  "location": "events.archeological-find.location",
  "description": "events.archeological-find.description",
  "stages": [
    {
      "leader": "viceroy",
      "skills": [
        "exploration"
      ],
      "criticalSuccess": {
        "msg": "events.archeological-find.stage-0.criticalSuccess.msg",
        "modifiers": [
          {
            "name": "Archeological Find",
            "buttonLabel": "+2 circumstance to Culture and Economy",
            "turns": 2,
            "enabled": true,
            "type": "circumstance",
            "value": 2,
            "applyIf": [
              {
                "some": [
                  {
                    "eq": [
                      "@ability",
                      "culture"
                    ]
                  },
                  {
                    "eq": [
                      "@ability",
                      "economy"
                    ]
                  }
                ]
              }
            ]
          }
        ]
      },
      "success": {
        "msg": "events.archeological-find.stage-0.success.msg"
      },
      "failure": {
        "msg": "events.archeological-find.stage-0.failure.msg"
      },
      "criticalFailure": {
        "msg": "events.archeological-find.stage-0.criticalFailure.msg",
        "modifiers": [
          {
            "name": "Reattempt Archeological Find",
            "buttonLabel": "Reattempt Archeological Find",
            "enabled": true,
            "type": "untyped",
            "value": -2
          }
        ]
      }
    }
  ]
}