{
  "id": "natures-blessing",
  "name": "events.natures-blessing.name",
  "traits": [
    "beneficial"
  ],
  "description": "events.natures-blessing.description",
  "stages": [
    {
      "leader": "magister",
      "skills": [
        "arts"
      ],
      "criticalSuccess": {
        "msg": "events.natures-blessing.stage-0.criticalSuccess.msg",
        "modifiers": [
          {
            "type": "untyped",
            "name": "events.natures-blessing.stage-0.criticalSuccess.modifiers.glow.name",
            "buttonLabel": "events.natures-blessing.stage-0.criticalSuccess.modifiers.glow.buttonLabel",
            "value": 0,
            "turns": 2,
            "enabled": true,
            "applyIf": [
              {
                "in": [
                  "@activity",
                  [
                    "create-a-masterpiece",
                    "craft-luxuries"
                  ]
                ]
              }
            ],
            "upgradeResults": [
              {
                "upgrade": "success"
              },
              {
                "upgrade": "failure"
              },
              {
                "upgrade": "criticalFailure"
              }
            ]
          }
        ]
      },
      "success": {
        "msg": "events.natures-blessing.stage-0.success.msg",
        "modifiers": [
          {
            "name": "events.natures-blessing.stage-0.success.modifiers.glow.name",
            "buttonLabel": "events.natures-blessing.stage-0.success.modifiers.glow.buttonLabel",
            "enabled": true,
            "value": 1,
            "turns": 2,
            "type": "status",
            "applyIf": [
              {
                "in": [
                  "@ability",
                  [
                    "culture",
                    "stability"
                  ]
                ]
              }
            ]
          }
        ]
      },
      "failure": {
        "msg": "events.natures-blessing.stage-0.failure.msg"
      },
      "criticalFailure": {
        "msg": "events.natures-blessing.stage-0.criticalFailure.msg"
      }
    }
  ]
}