{
  "id": "the-trial",
  "name": "events.the-trial.name",
  "traits": [
    "continuous",
    "downtime",
    "leadership"
  ],
  "description": "events.the-trial.description",
  "stages": [
    {
      "skills": [
        "intrigue",
        "politics",
        "statecraft"
      ],
      "leader": "emissary",
      "criticalSuccess": {
        "msg": "events.the-trial.stage-0.criticalSuccess.msg"
      },
      "success": {
        "msg": "events.the-trial.stage-0.success.msg"
      },
      "failure": {
        "msg": "events.the-trial.stage-0.failure.msg"
      },
      "criticalFailure": {
        "msg": "events.the-trial.stage-0.criticalFailure.msg"
      }
    }
  ],
  "resolvedOn": [
    "success",
    "criticalSuccess",
    "criticalFailure"
  ],
  "resolution": "events.the-trial.resolution"
}